{
  "$schema": "./schema.json",
  "kurumAdi": "T.C. ANKARA VALİLİĞİ İl Milli Eğitim Müdürlüğü",
  "antetSatirlari": [
    "T.C.",
    "ANKARA VALİLİĞİ",
    "İl Milli Eğitim Müdürlüğü"
  ],
  "belgeBasligi": "İŞ MAKİNESİ / HİZMET İŞLERİ GÜNLÜK ÇALIŞMA PUANTAJ ÇİZELGESİ",
  "dosyaKonusu": "Okul Bahçesi Zemin Tesviyesi ve Kazı Hizmet Alımı",
  "isinAdi": "Okul Bahçesi Zemin Tesviyesi ve Kazı Hizmet Alımı",
  "yukleniciFirma": "YILMAZLAR HAFRİYAT VE İNŞAAT LTD. ŞTİ.",
  "ayYil": "AĞUSTOS / 2026",
  "hizmetYeri": "Fen Lisesi İnşaat Sahası",
  "teminNo": "2026/042",
  "kontrolGorevlisi": "Ali CAN - İnşaat Mühendisi",
  "baskanAdi": "Mustafa DEMİR - Şube Müdürü",
  "kalemBasligi": "HİZMET / İFA / ARAÇ - MAKİNE KALEMİ",
  "ozellikBasligi": "ÖZELLİĞİ / PLAKA / NİTELİĞİ",
  "lejantMetni": "<b>İfa Sembolleri Lejandı:</b> <b>Sayısal Değer (m², Saat, Adet vb.):</b> Günlük Fiilen İfa Edilen İmalat / Çalışma Miktarı | <b>X:</b> Tam Gün Hizmet İfa Edildi | <b>-:</b> Çalışılmadı / Hava Muhalefeti / Tatil",
  "kabulBeyani": "<b>Tespit ve Kabul Beyanı:</b> Yukarıda ayrıntıları ve günlük dökümü yer alan hizmet ve imalatlar, yüklenici <b>YILMAZLAR HAFRİYAT VE İNŞAAT LTD. ŞTİ.</b> tarafından <b>AĞUSTOS / 2026</b> ayı çalışma dönemi içerisinde idaremiz denetim ve gözetiminde teknik şartname ile sözleşme/temin esaslarına uygun olarak yürütülmüş, fiili ölçüm ve hizmet ifa kayıtları denetlenerek hakedişe esas kabulü yapılmıştır.",
  "yukleniciUnvan": "HİZMET SUNUCU / YÜKLENİCİ",
  "kontrolUnvan": "KONTROL VE DENETİM TEŞKİLATI",
  "komisyonUnvan": "MUAYENE VE KABUL KOMİSYONU",
  "hizmetKalemleri": [
    {
      "siraNo": 1,
      "kalemAdi": "1 Nolu Paletli Ekskavatör İş Makinesi",
      "ozelligi": "22 Ton / Zemin Tesviye ve Kazı",
      "d1": "250 m²",
      "d2": "300 m²",
      "d3": "450 m²",
      "d4": "500 m²",
      "d5": "400 m²",
      "d6": "-",
      "d7": "-",
      "d8": "350 m²",
      "d9": "450 m²",
      "d10": "500 m²",
      "d11": "600 m²",
      "d12": "550 m²",
      "d13": "-",
      "d14": "-",
      "d15": "400 m²",
      "d16": "450 m²",
      "d17": "500 m²",
      "d18": "450 m²",
      "d19": "500 m²",
      "d20": "-",
      "d21": "-",
      "d22": "500 m²",
      "d23": "550 m²",
      "d24": "600 m²",
      "d25": "650 m²",
      "d26": "500 m²",
      "d27": "-",
      "d28": "-",
      "d29": "450 m²",
      "d30": "500 m²",
      "d31": "550 m²",
      "toplamMiktar": "11.450",
      "birim": "m²",
      "aciklama": "Şartnameye Uygun Tesviye Edildi"
    },
    {
      "siraNo": 2,
      "kalemAdi": "2 Nolu Lastikli Beko Loder Kepçe",
      "ozelligi": "JCB / Yükleme ve Saha Temizliği",
      "d1": "8 Saat",
      "d2": "8 Saat",
      "d3": "8 Saat",
      "d4": "8 Saat",
      "d5": "6 Saat",
      "d6": "-",
      "d7": "-",
      "d8": "8 Saat",
      "d9": "8 Saat",
      "d10": "8 Saat",
      "d11": "8 Saat",
      "d12": "8 Saat",
      "d13": "-",
      "d14": "-",
      "d15": "8 Saat",
      "d16": "8 Saat",
      "d17": "8 Saat",
      "d18": "8 Saat",
      "d19": "8 Saat",
      "d20": "-",
      "d21": "-",
      "d22": "8 Saat",
      "d23": "8 Saat",
      "d24": "8 Saat",
      "d25": "8 Saat",
      "d26": "8 Saat",
      "d27": "-",
      "d28": "-",
      "d29": "8 Saat",
      "d30": "8 Saat",
      "d31": "8 Saat",
      "toplamMiktar": "174",
      "birim": "Saat",
      "aciklama": "Yükleme İfası Yapıldı"
    }
  ]
}
